{
  "schema_version": "0.1.0",
  "run_id": "run-20260324T035822Z-a67e7582",
  "timestamp": "2026-03-24T03:58:22Z",
  "status": "skeleton_run",
  "project": "portable-memory-mvp",
  "scenario": {
    "scenario_id": "skeleton-demo",
    "title": "Benchmark skeleton placeholder run",
    "mode": "scaffold_only",
    "description": "This is a placeholder benchmark run produced by the benchmark runner skeleton."
  },
  "metrics": {
    "merge_success_rate": null,
    "conflicts_created": null,
    "conflicts_resolved": null,
    "retrieval_hit_rate": null,
    "retrieval_relevance_score": null,
    "context_bytes_without_memory": null,
    "context_bytes_with_memory": null,
    "context_reduction_percent": null,
    "repeated_explanation_items_removed": null,
    "package_count_used": null,
    "session_count_used": null
  },
  "human_eval": {
    "continuity_rating_0_to_5": null,
    "reduced_reexplaining_yes_no": null,
    "retrieved_right_state_yes_no": null,
    "felt_like_same_project_yes_no": null,
    "evaluator_notes": "No human evaluation captured in skeleton run."
  },
  "notes": [
    "Benchmark runner skeleton executed successfully.",
    "Real benchmark logic has not been implemented yet."
  ]
}